{"baseline":{"adversarialProtocolId":"eternities-portable-phase-host-adversarial-certification-v1","adversarialReceiptDigest":"0c1923a3033668b56e8013a98f7adad0f73a5a8cc93496848ff1c9d6ad72a4cc","conformanceProtocolId":"eternities-portable-phase-host-conformance-certification-v1","conformanceReceiptDigest":"4c82249de231aab58d35778e357ec03d8d830fe8421d58699fb95b2c55be0553"},"dossierDigest":"56b7be4c7358f1c34a0b718197183b6b7338f445fed23af002537a8819d9dde3","hostDescription":{"adapterId":"qualification-fixture","adapterVersion":"1","authority":{"continuityAdmission":false,"evolution":false,"identityOwnership":false,"inspiration":false,"personalKeelWrite":false,"realmEffects":false,"soul":false},"capabilities":{"credentialPreflight":true,"durableExecution":true,"localDispatchSemantics":"at-most-once","phases":["native","review","revision"],"structuredOutputs":true,"terminalReconciliation":"by-dispatch-digest"},"descriptionDigest":"49ff1abf8777dfdd581050139fe71e9c948a14332c799d274315e25b4d19760d","descriptors":{"native":{"atomicDeduplication":true,"authority":{"authorityExpanded":false,"continuityAdmission":false,"evolution":false,"identityOwnership":false,"personalKeelWrite":false,"realmEffects":false,"soul":false},"descriptorDigest":"d049d2a56522d8343a5157604f895dfa61093ce0860a08b01134f20e9cd55ddc","maximumCompletionBytes":1048576,"maximumDispatchBytes":1048576,"protocolId":"eternities-identity-bound-native-transport-v1","schemaVersion":1,"terminalReconciliation":"by-dispatch-digest","transportId":"portable-adversarial-native:aaaaaaaaaaaaaaaaaaaaaaaaaaaaaaaaaaaaaaaaaaaaaaaaaaaaaaaaaaaaaaaa"},"review":{"atomicDeduplication":true,"authority":{"authorityExpanded":false,"continuityAdmission":false,"evolution":false,"identityOwnership":false,"personalKeelWrite":false,"realmEffects":false,"soul":false},"descriptorDigest":"6ab7e29240c2a1313ac270fe797ed5bbe9c5cbb4ab6aee783391788aaddedd33","maximumCompletionBytes":1048576,"protocolId":"eternities-godskills-review-transport-v1","schemaVersion":1,"terminalReconciliation":"by-dispatch-digest","transportId":"portable-adversarial-review:aaaaaaaaaaaaaaaaaaaaaaaaaaaaaaaaaaaaaaaaaaaaaaaaaaaaaaaaaaaaaaaa"},"revision":{"atomicDeduplication":true,"authority":{"authorityExpanded":false,"continuityAdmission":false,"evolution":false,"identityOwnership":false,"personalKeelWrite":false,"realmEffects":false,"soul":false},"descriptorDigest":"207a93e668547cf65fd78700b5f3be1d442b6c4744a0778361cd919c4c5d9715","maximumCompletionBytes":1048576,"protocolId":"eternities-mission-revision-transport-v1","schemaVersion":1,"terminalReconciliation":"by-dispatch-digest","transportId":"portable-adversarial-revision:aaaaaaaaaaaaaaaaaaaaaaaaaaaaaaaaaaaaaaaaaaaaaaaaaaaaaaaaaaaaaaaa"}},"policyDigest":"aaaaaaaaaaaaaaaaaaaaaaaaaaaaaaaaaaaaaaaaaaaaaaaaaaaaaaaaaaaaaaaa","protocolId":"eternities-portable-phase-host-v1","schemaVersion":1},"hostDescriptionDigest":"49ff1abf8777dfdd581050139fe71e9c948a14332c799d274315e25b4d19760d","liveEvidence":null,"protocolId":"eternities-external-host-qualification-v1","schemaVersion":1,"status":"contract-only"}
